<?xml version="1.0" enIDing="UTF-8"?>
<admins xmlns:xsi="http://www.w3.org/2001/XMLSchema-instance" xsi:noNamespaceSchemaLocation="admins.xsd">
	<admin>
		<email>admin1@gmail.com</email>
		<riassuntoID>123411</riassuntoID>
	</admin>
	<admin>
		<email>admin2@gmail.com</email>
		<riassuntoID>123412</riassuntoID>
		<riassuntoID>123491</riassuntoID>
	</admin>
	<admin>
		<email>admin3@gmail.com</email>
	</admin>
</admins>